序號,擬參選人／政黨,選舉名稱,申報序號／年度,交易日期,收支科目,捐贈者／支出對象,身分證／統一編號,收入金額,支出金額,捐贈方式,存入專戶日期,返還/繳庫,支出用途,金錢類,地址,聯絡電話,應揭露之支出對象,支出對象之內部人員姓名,支出對象之內部人員職稱,政黨之內部人員姓名,政黨之內部人員職稱,關係,更正註記,資料更正日期
1,黃思婷,111年嘉義市議員選舉,首次申報,1110722,宣傳支出,元禎廣告社,14512690,0.00,4400.00,,,,製作競選物品或宣傳廣告費用（物品名稱-易拉展）,金錢,,,否,,,,,,,
2,黃思婷,111年嘉義市議員選舉,首次申報,1110729,宣傳支出,快樂工坊有限公司,54358862,0.00,10605.00,,,,製作競選物品或宣傳廣告費用（物品名稱-背包氣球套組）,金錢,,,否,,,,,,,
3,黃思婷,111年嘉義市議員選舉,首次申報,1110808,宣傳支出,正港廣播電台股份有限公司,80380489,0.00,13600.00,,,,宣傳廣告費用,金錢,,,否,,,,,,,
4,黃思婷,111年嘉義市議員選舉,首次申報,1111004,繳庫支出,監察院,03753307,0.00,100000.00,,,,繳庫,金錢,台北市忠孝東****,,否,,,,,,,
5,黃思婷,111年嘉義市議員選舉,首次申報,1111021,宣傳支出,元禎數位,14512690,0.00,1100.00,,,,製作競選物品或宣傳廣告費用（物品名稱-手拿牌）,金錢,,,否,,,,,,,
6,黃思婷,111年嘉義市議員選舉,首次申報,1111026,宣傳支出,元禎數位,14512690,0.00,3150.00,,,,手拿牌,金錢,,,否,,,,,,,
7,黃思婷,111年嘉義市議員選舉,首次申報,1111225,宣傳支出,翔創廣告設計有限公司,42958320,0.00,300000.00,,,,播放、傳送或刊登宣傳廣告費用,金錢,嘉義市東區大****,,否,,,,,,,
8,黃思婷,111年嘉義市議員選舉,首次申報,1111225,宣傳支出,翔創廣告設計有限公司,42958320,0.00,300000.00,,,,播放、傳送或刊登宣傳廣告費用,金錢,嘉義市東區大****,,否,,,,,,,
