序號,擬參選人／政黨,選舉名稱,申報序號／年度,交易日期,收支科目,捐贈者／支出對象,身分證／統一編號,收入金額,支出金額,捐贈方式,存入專戶日期,返還/繳庫,支出用途,金錢類,地址,聯絡電話,應揭露之支出對象,支出對象之內部人員姓名,支出對象之內部人員職稱,政黨之內部人員姓名,政黨之內部人員職稱,關係,更正註記,資料更正日期
1,王格致,111年花蓮縣議員選舉,首次申報,1110616,宣傳支出,雁山彩色印刷有限公司,94264320,0.00,600.00,,,,製作競選物品或宣傳廣告費用（物品名稱-請填寫）,金錢,花蓮縣吉安鄉****,0383*****,否,,,,,,,
2,王格致,111年花蓮縣議員選舉,首次申報,1110715,宣傳支出,陽須美,,0.00,12000.00,,,,租用廣告看板或車體廣告費用,金錢,花蓮縣吉安鄉****,,否,,,,,,,
3,王格致,111年花蓮縣議員選舉,首次申報,1111015,宣傳支出,更生日報,94768687,0.00,364293.00,,,,製作競選物品或宣傳廣告費用（物品名稱-請填寫）,金錢,花蓮縣花蓮市****,,否,,,,,,,
4,王格致,111年花蓮縣議員選舉,首次申報,1111020,宣傳支出,沈文魁,,0.00,8200.00,,,,其他與選舉宣傳有關之費用,金錢,花蓮縣吉安鄉****,0988*****,否,,,,,,,
5,王格致,111年花蓮縣議員選舉,首次申報,1111110,租用宣傳車輛支出,嚴德瑋,,0.00,30000.00,,,,雇用宣傳車輛駕駛費用,金錢,花蓮縣吉安鄉****,,否,,,,,,,
6,王格致,111年花蓮縣議員選舉,首次申報,1120224,返還捐贈支出,勝泰豐建設股份有限公司,27998153,0.00,20000.00,,,,返還,金錢,臺北市大安區****,,否,,,,,,,
