序號,擬參選人／政黨,選舉名稱,申報序號／年度,交易日期,收支科目,捐贈者／支出對象,身分證／統一編號,收入金額,支出金額,支出用途,金錢類,地址,聯絡電話,資料更正日期
1,簡志偉,107年直轄市議員選舉,首次申報,1070719,宣傳支出,興園股份有限公司,86575784,0.00,227200.00,租用廣告看板或車體廣告支出,金錢,桃園市桃園區****,,
2,簡志偉,107年直轄市議員選舉,首次申報,1070918,返還支出,萬科地產開發股份有限公司,42614064,0.00,100000.00,返還,金錢,臺北市內湖區****,,
3,簡志偉,107年直轄市議員選舉,首次申報,1071101,宣傳支出,良羑有限公司,12946690,0.00,157500.00,製作競選物品支出（物品名稱-請填寫）宣傳筆刨刀,金錢,新北市深坑區****,,
4,簡志偉,107年直轄市議員選舉,首次申報,1071115,宣傳支出,松和商行,81621211,0.00,43512.00,製作競選物品支出（物品名稱-請填寫）帽子彩帶,金錢,臺北市大同區****,,
5,簡志偉,107年直轄市議員選舉,首次申報,1071116,宣傳支出,松和商行,81621211,0.00,15300.00,製作競選物品支出（物品名稱-請填寫)帽子,金錢,臺北市大同區****,,
6,簡志偉,107年直轄市議員選舉,首次申報,1071206,宣傳支出,影響視覺科技有限公司,50872022,0.00,60000.00,設計費,金錢,臺北市大安區****,0928*****,
7,簡志偉,107年直轄市議員選舉,首次申報,1071206,宣傳支出,影響視覺科技有限公司,50872022,0.00,90000.00,製作競選物品支出（物品名稱-文宣卡片）,金錢,臺北市大安區****,,
8,簡志偉,107年直轄市議員選舉,首次申報,1071220,宣傳支出,利宇商行,31958301,0.00,30000.00,製作宣傳廣告支出,金錢,臺北市南港區****,,
9,簡志偉,107年直轄市議員選舉,首次申報,1071223,集會支出,好得優企業社,42557752,0.00,150000.00,租用設備支出總部成立大會音響帳棚桌椅,金錢,臺北市北投區****,,
