序號,擬參選人／政黨,選舉名稱,申報序號／年度,交易日期,收支科目,捐贈者／支出對象,身分證／統一編號,收入金額,支出金額,捐贈方式,存入專戶日期,返還/繳庫,支出用途,金錢類,地址,聯絡電話,應揭露之支出對象,支出對象之內部人員姓名,支出對象之內部人員職稱,政黨之內部人員姓名,政黨之內部人員職稱,關係,更正註記,資料更正日期
1,林武正,111年雲林縣議員選舉,首次申報,1110913,雜支支出,祥哲工業社,45767513,0.00,22000.00,,,,雜項購置或修繕費用,金錢,雲林縣虎尾鎮****,,否,,,,,,,
2,林武正,111年雲林縣議員選舉,首次申報,1111024,返還捐贈支出,鳳凰國際公關顧問有限公司,25015888,0.00,20000.00,,,,返還,金錢,高雄市仁武區****,,否,,,,,,,
3,林武正,111年雲林縣議員選舉,首次申報,1111105,宣傳支出,綠屋商行,39711252,0.00,440000.00,,,,製作競選物品或宣傳廣告費用（口罩、菜瓜布）,金錢,雲林縣虎尾鎮****,,否,,,,,,,
4,林武正,111年雲林縣議員選舉,首次申報,1111111,宣傳支出,虎尾旗幟社,92837168,0.00,110000.00,,,,製作競選物品或宣傳廣告費用（PP板）,金錢,雲林縣虎尾鎮****,05-6*****,否,,,,,,,
5,林武正,111年雲林縣議員選舉,首次申報,1111116,宣傳支出,尚佳企業社,45589383,0.00,340000.00,,,,製作競選物品或宣傳廣告費用（關東旗、立牌看板）,金錢,雲林縣虎尾鎮****,05-6*****,否,,,,,,,
6,林武正,111年雲林縣議員選舉,首次申報,1111118,宣傳支出,綜藝廣告,92831684,0.00,270000.00,,,,租用廣告看板或車體廣告費用,金錢,雲林縣虎尾鎮****,05-6*****,否,,,,,,,
7,林武正,111年雲林縣議員選舉,首次申報,1111120,宣傳支出,建宏紙品行,39668868,0.00,340000.00,,,,製作競選物品或宣傳廣告費用（文宣卡、宣傳單、邀請卡、名片）,金錢,雲林縣斗六市****,05-5*****,否,,,,,,,
8,林武正,111年雲林縣議員選舉,首次申報,1111124,宣傳支出,正聲廣播股份有限公司雲林廣播電台,15592474,0.00,20000.00,,,,播放、傳送或刊登宣傳廣告費用,金錢,雲林縣虎尾鎮****,05-6*****,否,,,,,,,
