序號,擬參選人／政黨,選舉名稱,申報序號／年度,交易日期,收支科目,捐贈者／支出對象,身分證／統一編號,收入金額,支出金額,捐贈方式,存入專戶日期,返還/繳庫,支出用途,金錢類,地址,聯絡電話,應揭露之支出對象,支出對象之內部人員姓名,支出對象之內部人員職稱,政黨之內部人員姓名,政黨之內部人員職稱,關係,更正註記,資料更正日期
1,林鼎超,111年新北市議員選舉,首次申報,1111111,宣傳支出,環華廣告行銷有限公司,27622826,0.00,700000.00,,,,租用廣告看板或車體廣告費用,金錢,臺北市中正區****,02-8*****,否,,,,,,,
2,林鼎超,111年新北市議員選舉,首次申報,1111111,宣傳支出,潤嘉實業有限公司,27807773,0.00,283500.00,,,,製作競選物品或宣傳廣告費用（物品名稱-濕紙巾）,金錢,新北市中和區****,02-2*****,否,,,,,,,
3,林鼎超,111年新北市議員選舉,首次申報,1111124,宣傳支出,迦勒廣告事業有限公司,42859882,0.00,927557.00,,,,租用廣告看板或車體廣告費用,金錢,臺北市大安區****,,否,,,,,,,
4,林鼎超,111年新北市議員選舉,首次申報,1111202,集會支出,雷夫數據科技股份有限公司,85015031,0.00,100000.00,,,,租用設備費用,金錢,臺北市松山區****,,否,,,,,,,
5,林鼎超,111年新北市議員選舉,首次申報,1111207,宣傳支出,東森新媒體控股股份有限公司,24328949,0.00,353808.00,,,,播放、傳送或刊登宣傳廣告費用,金錢,臺北市大安區****,02-5*****,否,,,,,,,
6,林鼎超,111年新北市議員選舉,首次申報,1111207,返還捐贈支出,夏恩國際教育股份有限公司,52690224,0.00,200000.00,,,,返還,金錢,新北市林口區****,,否,,,,,,,
