序號,擬參選人／政黨,選舉名稱,申報序號／年度,交易日期,收支科目,捐贈者／支出對象,身分證／統一編號,收入金額,支出金額,捐贈方式,存入專戶日期,返還/繳庫,支出用途,金錢類,地址,聯絡電話,應揭露之支出對象,支出對象之內部人員姓名,支出對象之內部人員職稱,政黨之內部人員姓名,政黨之內部人員職稱,關係,更正註記,資料更正日期
1,傅郁揚,111年苗栗縣議員選舉,首次申報,1110812,宣傳支出,沈氏藝術印刷股份有限公司,15820097,0.00,68406.00,,,,製作競選物品或宣傳廣告費用（易拉展、刀旗及旗座、塑膠面紙包）,金錢,新北市土城區****,,否,,,,,,,
2,傅郁揚,111年苗栗縣議員選舉,首次申報,1111001,宣傳支出,藍格印刷國際企業有限公司,22076600,0.00,12756.00,,,,製作競選物品或宣傳廣告費用（物品名稱-海報、名片、燈片、手舉牌、帆布）,金錢,臺北市內湖區****,,否,,,,,,,
3,傅郁揚,111年苗栗縣議員選舉,首次申報,1111027,雜支支出,凱耀電腦資訊行,,0.00,28000.00,,,,雜項購置或修繕費用,金錢,苗栗縣通霄鎮****,,否,,,,,,,
4,傅郁揚,111年苗栗縣議員選舉,首次申報,1111127,公共關係費用支出,吉美花坊,,0.00,10800.00,,,,為民服務費用,金錢,苗栗縣苑裡鎮****,,否,,,,,,,
5,傅郁揚,111年苗栗縣議員選舉,首次申報,1111130,宣傳支出,千舜廣告社,98163196,0.00,227000.00,,,,製作競選物品或宣傳廣告費用（物品名稱-製作及懸掛廣告看板）,金錢,苗栗縣竹南鎮****,,否,,,,,,,
