序號,擬參選人／政黨,選舉名稱,申報序號／年度,交易日期,收支科目,捐贈者／支出對象,身分證／統一編號,收入金額,支出金額,捐贈方式,存入專戶日期,返還/繳庫,支出用途,金錢類,地址,聯絡電話,應揭露之支出對象,支出對象之內部人員姓名,支出對象之內部人員職稱,政黨之內部人員姓名,政黨之內部人員職稱,關係,更正註記,資料更正日期
1,曾煥程,111年彰化縣議員選舉,首次申報,1110503,宣傳支出,速工坊廣告設計有限公司,,0.00,500.00,,,,其他與選舉宣傳有關之費用,金錢,彰化縣彰化市****,0472*****,否,,,,,,,
2,曾煥程,111年彰化縣議員選舉,首次申報,1110510,宣傳支出,速工坊廣告設計有限公司,,0.00,12700.00,,,,製作競選物品或宣傳廣告費用（候選人拜訪名片）,金錢,彰化縣彰化市****,0472*****,否,,,,,,,
3,曾煥程,111年彰化縣議員選舉,首次申報,1110510,宣傳支出,大楷數位印刷,,0.00,400.00,,,,其他與選舉宣傳有關之費用,金錢,彰化縣彰化市****,0472*****,否,,,,,,,
4,曾煥程,111年彰化縣議員選舉,首次申報,1110510,雜支支出,喜洋洋食品股份有限公司,59351924,0.00,1780.00,,,,餐飲費用,金錢,彰化縣彰化市****,0472*****,否,,,,,,,
5,曾煥程,111年彰化縣議員選舉,首次申報,1110517,宣傳支出,速工坊廣告設計有限公司,,0.00,5300.00,,,,製作競選物品或宣傳廣告費用（候選人拜訪名片）,金錢,彰化縣彰化市****,0472*****,否,,,,,,,
6,曾煥程,111年彰化縣議員選舉,首次申報,1110601,雜支支出,陳益發五金店,,0.00,6000.00,,,,雜項購置或修繕費用,金錢,彰化縣彰化市****,0472*****,否,,,,,,,
